{
  "$schema": "https://json-schema.org/draft/2020-12/schema",
  "title": "Forge Preferences",
  "description": "Host-neutral response-style preferences shared by Forge adapters.",
  "type": "object",
  "properties": {
    "technical_level": {
      "type": "string",
      "enum": ["newbie", "basic", "technical"],
      "default": "basic",
      "description": "How much Forge should translate or assume technical terminology."
    },
    "detail_level": {
      "type": "string",
      "enum": ["concise", "balanced", "detailed"],
      "default": "balanced",
      "description": "Preferred response depth."
    },
    "autonomy_level": {
      "type": "string",
      "enum": ["guided", "balanced", "autonomous"],
      "default": "balanced",
      "description": "How proactively Forge should move through safe steps."
    },
    "pace": {
      "type": "string",
      "enum": ["steady", "balanced", "fast"],
      "default": "balanced",
      "description": "Preferred working pace when Forge is driving a task forward."
    },
    "feedback_style": {
      "type": "string",
      "enum": ["gentle", "balanced", "direct"],
      "default": "balanced",
      "description": "How directly Forge should surface critique and gaps."
    },
    "personality": {
      "type": "string",
      "enum": ["default", "mentor", "strict-coach"],
      "default": "default",
      "description": "Preferred coaching style."
    },
    "language": {
      "type": "string",
      "description": "Optional output language hint."
    },
    "orthography": {
      "type": "string",
      "description": "Optional orthography hint."
    },
    "tone_detail": {
      "type": "string",
      "description": "Optional tone detail or honorific hint."
    },
    "output_quality": {
      "type": "string",
      "description": "Optional output quality hint kept string-compatible during the storage cut."
    },
    "custom_rules": {
      "type": "array",
      "items": {
        "type": "string"
      },
      "description": "Optional custom writing or execution rules."
    },
    "delegation_preference": {
      "type": "string",
      "enum": ["off", "auto", "review-lanes", "parallel-workers"],
      "default": "auto",
      "description": "Preferred delegation mode for compatible hosts."
    }
  },
  "additionalProperties": false
}
